{
  "schema_version": 2,
  "task_id": "startup-main-thread-cpu-001",
  "task_version": "0.1.0",
  "protocol_version": "phase-1a-v1",
  "lifecycle": "IMPLEMENTED",
  "artifacts": [
    {"kind": "TASK_SPEC", "partition": "DEVELOPMENT", "visibility": "PUBLIC", "status": "PRESENT", "relative_path": "SPEC.md", "sha256": "9ddb8d190ef2b4d5bc45a1371dad7a35dc123763200cae58e6fce88e142f1d89"},
    {"kind": "SOURCE", "partition": "DEVELOPMENT", "visibility": "PUBLIC", "status": "PRESENT", "relative_path": "public-task/app", "sha256": "d62eace825c24d028947101147b5c6eca4524fc666c503e3a990a436f919ecab"},
    {"kind": "PUBLIC_TASK", "partition": "DEVELOPMENT", "visibility": "PUBLIC", "status": "PRESENT", "relative_path": "public-task/task.yaml", "sha256": "bd1569abecb7e896682ec5c97650ac118a6fb84b749ec4973bfced67c36d0e4d"},
    {"kind": "CORRECTNESS_TESTS", "partition": "DEVELOPMENT", "visibility": "PUBLIC", "status": "PRESENT", "relative_path": "public-task/app/src/androidTest/java/dev/causalperf/startup/cpu/StartupCorrectnessTest.kt", "sha256": "d09f4a42c18c7838d11b3f3a4e69767d6a71950ce23825774c6c51d6bd437c4c"},
    {"kind": "BENCHMARK_SCENARIO", "partition": "DEVELOPMENT", "visibility": "PUBLIC", "status": "PRESENT", "relative_path": "public-task/macrobenchmark/src/main/java/dev/causalperf/startup/cpu/macrobenchmark/ColdStartupBenchmark.kt", "sha256": "2bf0ae2612829e05cac37e3d14f86add77a63ee3454286592077948a397f2b22"},
    {"kind": "GROUND_TRUTH", "partition": "DEVELOPMENT", "visibility": "PRIVATE", "status": "PRESENT", "relative_path": "private-evaluator/ground-truth.json", "sha256": "7a81b7bb73fd2d54be122508fb97989785542a28c102cfde53fe8353cc88f335"},
    {"kind": "REFERENCE_PATCH", "partition": "DEVELOPMENT", "visibility": "PRIVATE", "status": "PRESENT", "relative_path": "private-evaluator/expert-patch.diff", "sha256": "dd5a73cfc791b3ae0677a804d64a3290cb8cdaa75d6c522c01014af949320135"},
    {"kind": "ENVIRONMENT_SNAPSHOT", "partition": "CALIBRATION", "visibility": "PRIVATE", "status": "MISSING", "reason": "Android calibration has not started"},
    {"kind": "A1_B_A2_MEASUREMENTS", "partition": "CALIBRATION", "visibility": "PRIVATE", "status": "MISSING", "reason": "Android calibration has not started"},
    {"kind": "TRACES", "partition": "CALIBRATION", "visibility": "PRIVATE", "status": "MISSING", "reason": "Android calibration has not started"},
    {"kind": "MECHANISM_EVIDENCE", "partition": "CALIBRATION", "visibility": "PRIVATE", "status": "MISSING", "reason": "Mechanism query has not been validated on a trace"},
    {"kind": "VARIANCE_REPORT", "partition": "CALIBRATION", "visibility": "PRIVATE", "status": "MISSING", "reason": "No independent calibration sessions"},
    {"kind": "ENVIRONMENT_SNAPSHOT", "partition": "QUALIFICATION", "visibility": "PRIVATE", "status": "MISSING", "reason": "Fresh qualification collection has not started"},
    {"kind": "A1_B_A2_MEASUREMENTS", "partition": "QUALIFICATION", "visibility": "PRIVATE", "status": "MISSING", "reason": "Fresh qualification collection has not started"},
    {"kind": "TRACES", "partition": "QUALIFICATION", "visibility": "PRIVATE", "status": "MISSING", "reason": "Fresh qualification collection has not started"},
    {"kind": "MECHANISM_EVIDENCE", "partition": "QUALIFICATION", "visibility": "PRIVATE", "status": "MISSING", "reason": "Fresh qualification collection has not started"},
    {"kind": "VARIANCE_REPORT", "partition": "QUALIFICATION", "visibility": "PRIVATE", "status": "MISSING", "reason": "Fresh qualification collection has not started"},
    {"kind": "INDEPENDENT_REPLAY", "partition": "QUALIFICATION", "visibility": "PRIVATE", "status": "MISSING", "reason": "Qualification has not started"},
    {"kind": "LEAKAGE_REVIEW", "partition": "QUALIFICATION", "visibility": "PRIVATE", "status": "MISSING", "reason": "Qualification has not started"}
  ],
  "partitions": {
    "DEVELOPMENT": {
      "status": "OPEN",
      "session_ids": [],
      "artifact_sha256s": [
        "9ddb8d190ef2b4d5bc45a1371dad7a35dc123763200cae58e6fce88e142f1d89",
        "d62eace825c24d028947101147b5c6eca4524fc666c503e3a990a436f919ecab",
        "bd1569abecb7e896682ec5c97650ac118a6fb84b749ec4973bfced67c36d0e4d",
        "d09f4a42c18c7838d11b3f3a4e69767d6a71950ce23825774c6c51d6bd437c4c",
        "2bf0ae2612829e05cac37e3d14f86add77a63ee3454286592077948a397f2b22",
        "7a81b7bb73fd2d54be122508fb97989785542a28c102cfde53fe8353cc88f335",
        "dd5a73cfc791b3ae0677a804d64a3290cb8cdaa75d6c522c01014af949320135"
      ]
    },
    "CALIBRATION": {"status": "NOT_STARTED", "session_ids": [], "artifact_sha256s": []},
    "QUALIFICATION": {"status": "NOT_STARTED", "session_ids": [], "artifact_sha256s": []},
    "EVALUATION": {"status": "NOT_STARTED", "session_ids": [], "artifact_sha256s": []}
  }
}
