{"schema_version":2,"task_id":"startup-binder-blocking-001","task_version":"0.1.0","protocol_version":"phase-1a-v1","lifecycle":"DRAFT","artifacts":[{"kind":"TASK_SPEC","partition":"DEVELOPMENT","visibility":"PUBLIC","status":"PRESENT","relative_path":"SPEC.md","sha256":"06945f4c34dc3f0cb1d916fca8a371e28ecc894c17cd814adf284e19c08921d2"},{"kind":"SOURCE","partition":"DEVELOPMENT","visibility":"PUBLIC","status":"MISSING","reason":"Android task implementation has not started"}],"partitions":{"DEVELOPMENT":{"status":"OPEN","session_ids":[],"artifact_sha256s":["06945f4c34dc3f0cb1d916fca8a371e28ecc894c17cd814adf284e19c08921d2"]},"CALIBRATION":{"status":"NOT_STARTED","session_ids":[],"artifact_sha256s":[]},"QUALIFICATION":{"status":"NOT_STARTED","session_ids":[],"artifact_sha256s":[]},"EVALUATION":{"status":"NOT_STARTED","session_ids":[],"artifact_sha256s":[]}}}
