{"schema_version":2,"task_id":"startup-scheduling-starvation-001","task_version":"0.1.0","protocol_version":"phase-1a-v1","lifecycle":"DRAFT","artifacts":[{"kind":"TASK_SPEC","partition":"DEVELOPMENT","visibility":"PUBLIC","status":"PRESENT","relative_path":"SPEC.md","sha256":"d6b0ffb2fbfbbca31d3ef4252f9d05018ddb3932ddc5985192286efb82d9fc2d"},{"kind":"SOURCE","partition":"DEVELOPMENT","visibility":"PUBLIC","status":"MISSING","reason":"Android task implementation has not started"}],"partitions":{"DEVELOPMENT":{"status":"OPEN","session_ids":[],"artifact_sha256s":["d6b0ffb2fbfbbca31d3ef4252f9d05018ddb3932ddc5985192286efb82d9fc2d"]},"CALIBRATION":{"status":"NOT_STARTED","session_ids":[],"artifact_sha256s":[]},"QUALIFICATION":{"status":"NOT_STARTED","session_ids":[],"artifact_sha256s":[]},"EVALUATION":{"status":"NOT_STARTED","session_ids":[],"artifact_sha256s":[]}}}
